{"$defs":{"deployment":{"properties":{"created_at":{"format":"date-time","type":"string"},"id":{"pattern":"^dpl_[A-Za-z0-9]{20,}$","type":"string"},"source":{"type":"string"},"source_sha":{"pattern":"^[0-9a-f]{40}$","type":"string"},"state":{"type":"string"},"target":{"enum":["staging","production"]},"url":{"format":"uri","type":"string"}},"required":["id","url","target","state","source_sha","created_at"],"type":"object"},"rollbackQualification":{"properties":{"build_qualified":{"type":"boolean"},"database_qualified":{"type":"boolean"},"reason":{"type":"string"},"recovery_qualified":{"type":"boolean"},"rehearsed":{"type":"boolean"},"runtime_qualified":{"type":"boolean"},"source_qualified":{"type":"boolean"},"status":{"enum":["NOT_QUALIFIED","QUALIFIED"]}},"required":["status","source_qualified","build_qualified","runtime_qualified","database_qualified","recovery_qualified","rehearsed","reason"],"type":"object"}},"$id":"https://github.com/banataosystems/Pandoras-box/docs/releases/vercel/release-manifest.schema.json","$schema":"https://json-schema.org/draft/2020-12/schema","additionalProperties":false,"properties":{"authorized_at":{"format":"date-time","type":["string","null"]},"authorized_by":{"type":["string","null"]},"drift_detection":{"type":"object"},"environment_matrix":{"type":"object"},"evidence_freshness":{"type":"object"},"manifest_kind":{"enum":["provider_observation","release_candidate","production_release"]},"observed_at":{"format":"date-time","type":"string"},"projects":{"items":{"properties":{"artifact_hashes":{"type":"object"},"authorized_at":{"format":"date-time","type":["string","null"]},"authorized_by":{"type":["string","null"]},"build_evidence":{"type":"object"},"ci_runs":{"type":"array"},"database_cutoff":{"type":"object"},"edge_function_versions":{"type":"object"},"environment_fingerprint":{"type":"object"},"forward_recovery":{"type":"object"},"framework":{"type":"string"},"git_link":{"type":"object"},"pr_number":{"minimum":1,"type":["integer","null"]},"preview_deployment":{"type":["object","null"]},"production_branch":{"const":"main"},"production_deployment":{"$ref":"#/$defs/deployment"},"production_verification":{"type":"object"},"project":{"type":"string"},"region":{"type":"string"},"repository":{"pattern":"^[A-Za-z0-9_.-]+/[A-Za-z0-9_.-]+$","type":"string"},"review_sha":{"pattern":"^[0-9a-f]{40}$","type":["string","null"]},"reviewer_identity":{"type":["string","null"]},"rollback_candidate":{"type":"object"},"rollback_qualification":{"$ref":"#/$defs/rollbackQualification"},"runtime":{"type":"string"},"runtime_evidence":{"type":"object"},"security_evidence":{"type":"object"},"source_sha":{"pattern":"^[0-9a-f]{40}$","type":"string"},"staging_deployment":{"$ref":"#/$defs/deployment"},"tree_sha":{"pattern":"^[0-9a-f]{40}$","type":"string"},"vercel_project_id":{"pattern":"^prj_[A-Za-z0-9]{20,}$","type":"string"},"vercel_project_name":{"type":"string"},"verified_at":{"format":"date-time","type":"string"}},"required":["project","vercel_project_name","vercel_project_id","repository","production_branch","framework","runtime","region","source_sha","tree_sha","pr_number","review_sha","reviewer_identity","ci_runs","git_link","preview_deployment","staging_deployment","production_deployment","environment_fingerprint","database_cutoff","edge_function_versions","artifact_hashes","build_evidence","security_evidence","runtime_evidence","rollback_candidate","rollback_qualification","forward_recovery","authorized_by","authorized_at","verified_at","production_verification"],"type":"object"},"minItems":1,"type":"array"},"release_candidates":{"type":"array"},"release_id":{"maxLength":128,"minLength":8,"type":"string"},"release_model":{"type":"object"},"schema_version":{"const":"1.0.0"},"team":{"properties":{"id":{"pattern":"^team_[A-Za-z0-9]{20,}$","type":"string"},"name":{"minLength":1,"type":"string"},"slug":{"minLength":1,"type":"string"}},"required":["id","slug","name"],"type":"object"},"verified_at":{"format":"date-time","type":"string"}},"required":["schema_version","release_id","manifest_kind","observed_at","evidence_freshness","team","release_model","environment_matrix","projects","release_candidates","drift_detection","authorized_by","authorized_at","verified_at"],"title":"Pandora Vercel release evidence manifest","type":"object"}
