{"authorized_at":null,"authorized_by":null,"drift_detection":{"current_production_aliases_resolve_to_recorded_deployments":true,"current_production_source_matches_canonical_main":true,"failure_policy":"Any mismatch between Memory and current provider readback fails closed; preserve prior evidence as superseded before correcting canonical state.","git_link_memory_claim_superseded":{"current_provider_result":"Both canonical Vercel projects are Git-linked and recent PR pushes create exact-SHA previews.","historical_claim":"Git integration absent","superseded":true},"manual_redeploy_or_alias_reassignment_alarm_implemented":false,"stable_staging_aliases_directly_resolve_to_recorded_staging_deployments":true},"environment_matrix":{"development":{"configuration_scope_readback":"unknown","notes":"No live Vercel development target was proven.","provider_target":null,"stable_url":null},"preview":{"configuration_scope_readback":"unknown","edge_identity_environment_claim_required_in_source":true,"live_preview_identity_denial_proven":false,"mcp_protection_observation":"Public exact-head preview health returned HTTP 200.","memory_protection_observation":"Vercel Authentication returned HTTP 302 on Memory preview/staging observations.","production_backend_target_from_committed_mcp_config":true,"production_mutation_request_enabled_by_committed_mcp_config":true,"production_secret_availability":"unknown","provider_target":null,"stable_url":null},"production":{"mcp_boundary_observation":"HTTP 200 on /health","mcp_domain":"https://mcpmaster.vercel.app","memory_boundary_observation":"HTTP 401 on unauthenticated /api/projectos/health","memory_domain":"https://pandorasbox-memory.vercel.app","provider_target":"production"},"staging":{"configuration_scope_readback":"unknown","mcp_deployment_id":"dpl_5Y3YmFgQ1Heg5nrH73g8uBvraELm","mcp_protection_observation":"Public health endpoint returned HTTP 200.","mcp_stable_url":"https://mcpmaster-mbanatao-dc676069.vercel.app","memory_deployment_id":"dpl_2Jf1Q2hygGgf8saarFQMTszJkSnH","memory_protection_observation":"Vercel Authentication returned HTTP 302.","memory_stable_url":"https://memory-mbanatao-dc676069.vercel.app","provider_target":"staging"}},"evidence_freshness":{"memory_context_status":"degraded_stale","provider_observed_at":"2026-08-18T22:24:21Z","reconciliation_rule":"Fresh GitHub, Vercel, and Worker 2 authenticated Supabase evidence supersedes older deployment claims while preserving their provenance.","status":"fresh_provider_readback"},"manifest_kind":"provider_observation","observed_at":"2026-08-18T22:24:21Z","projects":[{"artifact_hashes":{"source_tree_git_sha1":"d6d848a1d87b0e9e5561fceba200c4cad05fb4e8","vercel_config_git_blob_sha1":"a9e3ccc2acceaa1d6df1e9d3636829e761583ed1"},"authorized_at":null,"authorized_by":null,"build_evidence":{"build_command":"npm run build","cache_restored":true,"clean_install_proven":false,"exact_source_clone":true,"node_version":"24.x","package_manager":"npm","result":"READY"},"ci_runs":[],"database_cutoff":{"exact_live_catalog_complete":false,"forward_recovery_required_subsystems":10,"migration_identity_count":68,"migration_sources_exact_or_authentic":14,"migration_sources_missing":53,"migration_sources_sanitized":1,"reason":"Worker 2 current exact-head evidence qualifies rollback for 0/10 subsystems; authentic SQL is missing for 53 migrations and complete live catalog compatibility remains unproven.","rollback_qualified_subsystems":0,"status":"not_qualified","supabase_project_ref":"ivmvufhcsezyhczzondn","worker_2_ci_runs":[32191770262,32191770190,32191770080],"worker_2_pr":42,"worker_2_source_sha":"a3673f3718ea0fba570563b5397d8600913b2e71","worker_2_tree_sha":"592b415d935506786be9da04078d4e95ee5f7794"},"edge_function_versions":{"bridge_name":"pandora-projectos-bridge","bridge_provider_hash":"3c63c366389e9cc294b548643738b06d0e594a6ee064a6976dd558e489f5fe0a","bridge_version":13,"required_capability_live":false,"required_capability_name":"submit_evidence_candidate","status":"provider_metadata_verified_source_parity_not_verified"},"environment_fingerprint":{"committed_variable_names":["PANDORA_MEMORY_BASE_URL","PANDORA_MEMORY_GRANTED_SCOPES","PANDORA_MEMORY_ALLOW_MUTATIONS","PROJECTOS_MCP_RESOURCE_ORIGIN","MCPMASTER_GITHUB_ACCOUNT_ID","FLUTTERFLOW_ACCOUNTS_JSON"],"committed_vercel_config_git_blob_sha":"a9e3ccc2acceaa1d6df1e9d3636829e761583ed1","provider_variable_scope_readback":"unknown","risk":"Committed configuration applies production Memory origin and write intent across deployments; live preview credential scope and preview identity denial remain unproven.","secret_values_recorded":false},"forward_recovery":{"path":"Use a dedicated hotfix against current source, deploy reviewed additive backend corrections where required, verify exact-head preview/staging, then separately authorize production promotion.","required_if_current_database_contract_cannot_support_candidate":true},"framework":"container","git_link":{"configured":true,"main_push_creates_production":true,"main_push_creates_staging":true,"pr_push_creates_preview":true,"production_branch":"main","repository":"banataosystems/Pandoras-box"},"pr_number":52,"preview_deployment":null,"production_branch":"main","production_deployment":{"aliases":["https://mcpmaster.vercel.app","https://pandoras-box-system.vercel.app","https://mcpmaster-hazel.vercel.app"],"created_at":"2026-08-18T18:07:36.903Z","id":"dpl_CLg3L8iDJpCHVLfRtyNjMFoSis3Y","source":"git","source_sha":"c2cc635383b78d457d1731294a6f5b306d85f6be","state":"READY","target":"production","url":"https://mcpmaster-482v0cj4c-mbanatao-dc676069.vercel.app"},"production_verification":{"authenticated_functional_contract":false,"exact_source_matches_main":true,"http_boundary":true,"overall":false,"production_alias_binding":true,"provider_provenance":true,"runtime_warning_free":false},"project":"Pandora / MCPMaster","region":"iad1","repository":"banataosystems/Pandoras-box","review_sha":null,"reviewer_identity":null,"rollback_candidate":{"created_at":"2026-08-18T17:59:02.780Z","health_readback":"HTTP 200 on /health","id":"dpl_9mgYyiPJQFDBfVU975CsihuqvtBT","provider_retrievable":true,"source_delta_to_current":"One committed vercel.json line selecting github-primary; no migration files changed.","source_sha":"c58c7c201c36454561330f798757cdbb3e3434e0","url":"https://mcpmaster-100im990u-mbanatao-dc676069.vercel.app","was_production":true},"rollback_qualification":{"build_qualified":true,"database_qualified":false,"reason":"Worker 2 qualifies 0/10 rollback subsystems; database compatibility and promotion/restoration rehearsal are not proven.","recovery_qualified":false,"rehearsed":false,"runtime_qualified":true,"source_qualified":true,"status":"NOT_QUALIFIED"},"runtime":"nodejs-24.x","runtime_evidence":{"failure_path_snapshot":{"http_500":{"/mcp":296},"http_502":{"/mcp":104},"non_atomic_snapshot":true},"health":{"contract":"healthy","path":"/health","status":200},"production_warning_attribution":{"current_production_24h_direct_query":"no matching logs","current_production_7d_direct_query":"timed_out","status":"unresolved_not_warning_free"},"project_wide_warning_snapshot":{"code":"DEP0169","count":228,"last_deployment":"dpl_DtgjJX7QgcnCNMRXJrXPsVuKEBB3","last_seen":"2026-08-18T22:02:58Z","routes":["/api/oauth-consent","/api/mcp","/api/operator","/api/projectos"]},"runtime_error_free":false,"status_count_snapshot":{"200":921,"202":230,"400":2,"401":21,"404":2,"500":294,"502":98,"reported_distinct_values":8,"top_values_only":true}},"security_evidence":{"deployment_protection_configuration_readback":"unknown","no_credential_values_in_manifest":true,"preview_production_secret_exposure":"unknown","production_memory_identity_environment_gate_in_source":true,"production_memory_identity_environment_gate_live_row":"unknown"},"source_sha":"c2cc635383b78d457d1731294a6f5b306d85f6be","staging_deployment":{"created_at":"2026-08-18T18:15:03.320Z","id":"dpl_5Y3YmFgQ1Heg5nrH73g8uBvraELm","source":"git","source_sha":"c2cc635383b78d457d1731294a6f5b306d85f6be","stable_alias":"https://mcpmaster-mbanatao-dc676069.vercel.app","state":"READY","target":"staging","url":"https://mcpmaster-omnu62q7k-mbanatao-dc676069.vercel.app"},"tree_sha":"d6d848a1d87b0e9e5561fceba200c4cad05fb4e8","vercel_project_id":"prj_Y5rZVcq8xJVzHVt4uvfmg9wPvXMk","vercel_project_name":"mcpmaster","verified_at":"2026-08-18T22:24:21Z"},{"artifact_hashes":{"source_tree_git_sha1":"349d686418bcc4fd2d1bf933544146d72cb005d4"},"authorized_at":null,"authorized_by":null,"build_evidence":{"build_system":"turbopack","cache_restored":true,"clean_install_proven":false,"exact_source_clone":true,"framework_version":"nextjs-16.3.1","node_version":"24.x","package_manager":"npm","result":"READY"},"ci_runs":[],"database_cutoff":{"exact_live_catalog_complete":false,"forward_recovery_required_subsystems":10,"migration_identity_count":68,"migration_identity_etag_match":true,"migration_identity_payload_sha256":"0d6110e17a01304eebb57cca57369f7b9b6961eb7a23b2c40871c8d90f5da0f3","migration_sources_exact_or_authentic":14,"migration_sources_missing":53,"migration_sources_sanitized":1,"provider_project_status":"ACTIVE_HEALTHY","reason":"Worker 2 authenticated provider evidence proves the live migration identity list but not authentic SQL for 53 migrations or complete catalog compatibility.","rollback_qualified_subsystems":0,"status":"not_qualified","supabase_project_ref":"ivmvufhcsezyhczzondn","worker_2_ci_runs":[32191770262,32191770190,32191770080],"worker_2_pr":42,"worker_2_source_sha":"a3673f3718ea0fba570563b5397d8600913b2e71","worker_2_tree_sha":"592b415d935506786be9da04078d4e95ee5f7794"},"edge_function_versions":{"complete_inventory":false,"records":[{"name":"pandora-projectos-bridge","provider_hash":"3c63c366389e9cc294b548643738b06d0e594a6ee064a6976dd558e489f5fe0a","status":"ACTIVE","version":13},{"name":"pandora-projectos-learning","provider_hash":"eec5a67e3e9af88850aa2a0e98dca7a344a54086b51166b5cc0a91e2b0ac82fe","status":"ACTIVE","vers